{
  "version": "RM-1.0",
  "release": "v1.0.0-draft",
  "evidence": [
    "AND-001",
    "API-001",
    "CI-001",
    "CL-001",
    "ES-001",
    "EX-001",
    "EX-002",
    "EX-003",
    "IOS-001",
    "PB-001",
    "PKG-001",
    "PKG-002",
    "PKG-003",
    "SS-001",
    "TS-001",
    "TS-002",
    "TS-003",
    "TS-004",
    "TS-005",
    "TS-006",
    "TS-007",
    "UT-003",
    "UT-004",
    "UT-005",
    "UT-006",
    "UT-007"
  ],
  "waivers": [
    "WAIVER-001",
    "WAIVER-002"
  ]
}